{"txId":"0x6666666666666666666666666666666666666666666666666666666666666666","parentTxId":"0x2222222222222222222222222222222222222222222222222222222222222222","role":"TARGET_ACTION","lifecycle":{"txId":"0x6666666666666666666666666666666666666666666666666666666666666666","rawStatus":"FINALIZED","rawResult":"MAJORITY_AGREE","protocolDecisionOutcome":"accepted","decidedAtBlock":120502,"appealDeadline":null,"derived":{"displayLabel":"Finalized · Accepted","isFinal":true}},"executionResult":"FINISHED_WITH_RETURN"}
